<?xml version="1.0" encoding="UTF-8"?>
<opensftp-config xmlns="http://opensftp.sf.net/opensftp-config"
	xmlns:xsi="http://www.w3.org/2001/XMLSchema-instance"
	xsi:schemaLocation="http://opensftp.sf.net/opensftp-config opensftp-config.xsd ">
	<sftputil-impl>sftputil-impl</sftputil-impl>
	<interceptors>
		<interceptor type="net.sf.opensftp.LoggingInterceptor"/>
		<interceptor type="net.sf.opensftp.MonitoringInterceptor">
			<property name="" type="" value="" />
		</interceptor>
		<interceptor type="net.sf.opensftp.DummyInterceptor">
			<property name="dummyfield1" type="string" value="value1" />
			<property name="dummyfield2" type="int" value="2" />
		</interceptor>
	</interceptors>
</opensftp-config>
